{
  "apiVersion": "cartograph/v1",
  "kind": "Flow",
  "metadata": {
    "id": "assumption",
    "name": "Assumption"
  },
  "spec": {
    "for": "Assumption",
    "steps": [
      {
        "key": "statement",
        "title": "Assumption",
        "guide": "Something you expect to be true but have not proved, and the part of the plan that depends on it.",
        "fields": [
          {
            "path": "/metadata/name",
            "control": "text"
          },
          {
            "path": "/spec/statement",
            "control": "sentence"
          }
        ],
        "links": [
          {
            "kind": "Programme",
            "path": "/spec/pathway/-/assumes"
          },
          {
            "kind": "Project",
            "path": "/spec/successCriteria/-/assumes"
          }
        ]
      },
      {
        "key": "consequence",
        "title": "If false",
        "guide": "What goes wrong if this turns out to be false.",
        "fields": [
          {
            "path": "/spec/ifFalse",
            "control": "sentence"
          }
        ]
      },
      {
        "key": "confidence",
        "title": "Confidence",
        "guide": "How sure you are that it is true.",
        "fields": [
          {
            "path": "/spec/confidence",
            "control": "choice"
          }
        ]
      },
      {
        "key": "verification",
        "title": "How to check",
        "guide": "How you would find out whether it is true.",
        "fields": [
          {
            "path": "/spec/testedBy",
            "control": "reference"
          }
        ]
      },
      {
        "key": "note",
        "title": "Note",
        "guide": "Anything else worth knowing, such as who doubted it and why.",
        "optional": true,
        "fields": [
          {
            "path": "/spec/note",
            "control": "sentence"
          }
        ]
      }
    ],
    "review": true
  }
}
