{
  "apiVersion": "cartograph/v1",
  "kind": "Flow",
  "metadata": {
    "id": "settings",
    "name": "Settings"
  },
  "spec": {
    "for": "Settings",
    "steps": [
      {
        "key": "terms",
        "title": "Level names",
        "guide": "Your own words for the strategy levels and for a project, if you use different ones.",
        "optional": true,
        "fields": [
          {
            "path": "/metadata/name",
            "control": "text"
          },
          {
            "path": "/spec/goalLevels",
            "control": "list",
            "title": "Goal levels"
          },
          {
            "path": "/spec/projectLevelName",
            "control": "text",
            "title": "Project"
          },
          {
            "path": "/spec/vocabularies",
            "control": "list",
            "title": "Vocabularies",
            "hint": "The words this workspace uses where a field's choices are its own, such as its classification levels. A list set here replaces the standard one."
          }
        ]
      },
      {
        "key": "configuration",
        "title": "Configuration",
        "guide": "The name changes are saved under when no one is signed in, and the browser used to make PDFs.",
        "optional": true,
        "fields": [
          {
            "path": "/spec/operator",
            "control": "text",
            "title": "Operator"
          },
          {
            "path": "/spec/chromium",
            "control": "text",
            "title": "Chromium path"
          }
        ]
      },
      {
        "key": "change-control",
        "title": "Change control",
        "guide": "Whether every change goes through a change set, and what a change set needs before it is rolled in.",
        "optional": true,
        "fields": [
          {
            "path": "/spec/changeControl/changeSetsRequired",
            "control": "toggle",
            "title": "Every change in a change set"
          },
          {
            "path": "/spec/changeControl/rollIn/checksMet",
            "control": "toggle",
            "title": "Every check met before rolling in"
          },
          {
            "path": "/spec/changeControl/rollIn/nothingLeftOpen",
            "control": "toggle",
            "title": "Nothing left open before rolling in"
          },
          {
            "path": "/spec/changeControl/rollIn/secondReviewer",
            "control": "toggle",
            "title": "Rolled in by someone other than its author"
          }
        ]
      }
    ],
    "review": true
  }
}
