{
  "apiVersion": "cartograph/v1",
  "kind": "Flow",
  "metadata": {
    "id": "operation",
    "name": "Operation"
  },
  "spec": {
    "for": "Operation",
    "steps": [
      {
        "key": "service",
        "title": "Service",
        "guide": "What the service does, who is responsible for it, who runs it, and when.",
        "fields": [
          {
            "path": "/metadata/name",
            "control": "text"
          },
          {
            "path": "/spec/purpose",
            "control": "sentence",
            "hint": "What this service does every day.",
            "checks": [
              "service-purpose"
            ]
          },
          {
            "path": "/spec/status",
            "control": "choice",
            "title": "Status",
            "hint": "Planned until the project that sets it up hands it over; running once it is in use.",
            "checks": [
              "service-status"
            ]
          },
          {
            "path": "/spec/serviceOwner",
            "control": "reference",
            "title": "Service owner",
            "hint": "The role accountable for the service end to end.",
            "checks": [
              "service-owner"
            ]
          },
          {
            "path": "/spec/team",
            "control": "reference"
          },
          {
            "path": "/spec/serviceWindow",
            "control": "text",
            "title": "Service hours",
            "checks": [
              "service-hours"
            ]
          },
          {
            "path": "/spec/funding",
            "control": "list",
            "key": "currency",
            "title": "Running costs",
            "hint": "What the service costs to run, per month or per year, and which budget pays.",
            "fields": [
              {
                "path": "/amount",
                "control": "number"
              },
              {
                "path": "/currency",
                "control": "choice"
              },
              {
                "path": "/per",
                "control": "choice",
                "title": "Per"
              },
              {
                "path": "/source",
                "control": "reference",
                "title": "Budget"
              },
              {
                "path": "/status",
                "control": "choice"
              }
            ]
          }
        ],
        "links": [
          {
            "kind": "Project",
            "path": "/spec/operation",
            "check": "service-status",
            "phase": "align"
          }
        ]
      },
      {
        "key": "alignment",
        "title": "Alignment",
        "guide": "The programmes this service is part of, if any.",
        "optional": true,
        "fields": [
          {
            "path": "/spec/programmes",
            "control": "references",
            "checks": [
              "alignment-programmes"
            ]
          }
        ],
        "phase": "align"
      },
      {
        "key": "measures",
        "title": "Service levels",
        "guide": "The indicators that show whether the service is running as it should.",
        "fields": [
          {
            "path": "/spec/kpis",
            "control": "references",
            "title": "Indicators",
            "checks": [
              "measures-kpis"
            ]
          }
        ],
        "phase": "measure"
      },
      {
        "key": "data",
        "title": "Data",
        "guide": "The data the service uses, the data it creates or adds to, and where that data is stored.",
        "optional": true,
        "fields": [
          {
            "path": "/spec/data/consumes",
            "control": "list",
            "key": "source",
            "title": "Data used",
            "fields": [
              {
                "path": "/source",
                "control": "reference"
              },
              {
                "path": "/purpose",
                "control": "sentence"
              },
              {
                "path": "/handoff",
                "control": "choice"
              },
              {
                "path": "/personalData",
                "control": "choice"
              }
            ]
          },
          {
            "path": "/spec/data/produces",
            "control": "list",
            "key": "sink",
            "title": "Data produced",
            "fields": [
              {
                "path": "/output",
                "control": "choice"
              },
              {
                "path": "/sink",
                "control": "reference"
              },
              {
                "path": "/purpose",
                "control": "sentence"
              },
              {
                "path": "/refresh",
                "control": "choice"
              },
              {
                "path": "/personalData",
                "control": "choice"
              }
            ]
          }
        ]
      },
      {
        "key": "mandate",
        "title": "Mandate",
        "guide": "The decisions, policies, laws or contracts that require or authorise the service.",
        "optional": true,
        "fields": [
          {
            "path": "/spec/mandate",
            "control": "list",
            "key": "title",
            "fields": [
              {
                "path": "/kind",
                "control": "choice"
              },
              {
                "path": "/title",
                "control": "text"
              },
              {
                "path": "/reference",
                "control": "text"
              },
              {
                "path": "/date",
                "control": "date"
              },
              {
                "path": "/issuer",
                "control": "reference",
                "title": "Issued by",
                "hint": "A board, committee or role already in Cartograph."
              },
              {
                "path": "/issuedBy",
                "control": "text",
                "title": "Or someone not in Cartograph",
                "hint": "An organisation not listed in Cartograph, such as a regulator."
              }
            ]
          },
          {
            "path": "/spec/notes",
            "control": "sentence"
          }
        ]
      }
    ],
    "review": true
  }
}
